"Regulators in Canada, the Ontario Securities Commission (OSC) has announced again that Binance, the world’s largest crypto exchange isn’t authorized to operate in Ontario, according to the province’s securities regulator.",1641075083.0
I don't get the hype behind NFTs and I think they are idiotic.,1641037425.0
Moons - unanswered questions...,1641110971.0
Friendly advice for any beginners: be VERY cautious when discovering coins via r/CryptoMoonShots,1641075534.0
"Kraken to Double Professional Team Again in 2022, Plans to Employ Over 5000 Professionals This Year",1641100798.0
I Decided To Go Yolo in Randoms for fun: One month Update,1641105780.0
How rollups make Ethereum more efficient,1641129271.0
"Biggest Ethereum Whales Loading Up on Three Decentralized Finance Altcoins As Top Wallet Buys $17,000,000 Worth of Sushi",1641134317.0
"Where can I find TRUE average prices of bitcoin? (if you hold crypto, you should care about these prices)",1641077736.0
If you think crypto is your only hope you are already in danger,1641144495.0
"El Salvador President Nayib Bukele Strongly Believes Bitcoin Will Hit $100,000 This Year",1641129703.0
What are your opinions on XYO? It “has a function” and therefore could end up becoming big *if* the technology is implemented,1641140702.0
How long are you planning to HODL for? Most people won't be patient enough,1641138678.0
A few things I have learned in the last month.,1641157919.0
I can teach you how to never pay taxes on your crypto. You can easily do the same with just a couple easy to follow steps. Disclaimer: I don’t know what the fuck I’m talking about.,1640986814.0
Riches are great and technologic revolution is innovation. Don’t forget to actually live your life though.,1641060124.0
Russia’s Sberbank launches first blockchain ETF in the country,1641127708.0
Three reasons why PlanB’s stock-to-flow model is not reliable,1641132948.0
Invest in storage projects,1641021093.0
Bitcoin Usage Reportedly Drops 89% In El Salvador,1641055382.0
So long as nancy pelosi does insider trading blah blah blah.... taxes.,1641044131.0
Web Giant Mozilla To Officially Accept Cryptocurrencies as Donations,1641056276.0
Will Global Chip Shortage End After Eth PoS Rolls Out?,1641133164.0
"I've kind of forgotten about crypto recently, and I think that's a good thing",1641159031.0
Binance CEO Says Centralized Crypto Services Will Stay Here,1641032776.0
"According to research, Cardano was the most developed cryptocurrency on Github in 2021",1641140018.0
People don’t care much about Cardano today because it isn’t pumping anymore and it’s kinda sad.,1641010961.0
What's the general educational / work background of this sub as it relates to crypto?,1641108080.0
$CELR thoughts or predictions.,1641095152.0
Banks Tried to Kill Crypto and Failed. Now They’re Embracing It Slowly,1641086295.0
Someone in my discord made a video on avoiding getting scammed on MetaMask. Huge help these days!,1641075217.0
What the fuck are Literature NFTs?,1641151502.0
"Don't FOMO with these ""if you invested $1000"" posts. Here are some lack luster gains from Jan 2021",1641147012.0
Harmony vs Ethereum: The Only ONE Blockchain to Rise by 1000%,1641152118.0
Tezos In 2021: A Year Of Adoption And Growth,1641036377.0
If you put maximum effort to studying crypto everyday in 2022 how much could you achieve?,1641117006.0
RadioShack to rebrand as cryptocurrency exchange platform,1640975910.0
Around 21 million new Indians traded Crypto in 2021!!,1641028992.0
People talk about stocks vs. crypto like they're competing investment markets. I'm waiting for the day that stocks can be bought with crypto,1641096915.0
This is my 3rd vault that I have lost access too. WTF!,1641110251.0
BTC uses half the electricity of the Bank and Gold industry. Let's stop being manipulated by mainstream media and those people who like to get outraged about stuff they didn't even look up.,1641110178.0
What do you think about the Pi Network?,1641156185.0
Can a meme coin turn into a useful project? Shiba Inu Launches Beta Version of DAO,1641157879.0
I'm into Crypto for hookers and cocaine. Happy New Year,1641139761.0
What's the sentiment around ICX?,1641134243.0
El Salvador President Nayib Bukele Predicts Two More Countries Will Make Bitcoin Legal Tender In 2022,1641126724.0
Can someone link me to the official Trezor shop and maybe even show me what an invoice from them looks like?,1641075921.0
New Cryptocurrency Puzzle! 0.015 Eth Prize,1641056530.0
Cheapest way to DCA into crypto,1641120127.0
"Most important thing you get from 2021 is your increased crypto knowledge. Your portfolio can be down and it just happen, but if you learned nothing on your own mistakes then you truly failed.",1641057522.0
Why AMP could keep growing long-term,1641080226.0
ETH layer 2 downside on price,1641074544.0
"Lot's of 'tips' going around, what was the best and worst you've heard in 2021?",1641046354.0
"Cardano was the most-developed crypto on Github in 2021, study finds",1641034095.0
If you've lost crypto it's probably in North Korea,1641119863.0
Bitcoin's $6.1 billion options expiry was not enough to break the bearish sentiment,1641029684.0
In 2022 all things will be different,1641029491.0
"What ecosystem have you actually played with and what do you think of the landscape so far? For example: I've used many of the most popular dapps on Harmony ONE: (Defi Kingdoms, Freyala, Tranquil), and I feel like it's going places!",1641145816.0
Join our brethren in crypto in their class action law suit against Coinbase,1641126190.0
What are some other good crypto news/discussion subreddits like this one?,1641152716.0
What’s the deal with AAVE?,1641139417.0
HODLing and DCAing will always beat trading,1641121289.0
"Thoughts On Crypto's Future, Because 2022",1641158458.0
"Billionaire Chamath Palihapitiya says Visa and Mastercard will be the biggest business failures in 2022, losing out to altcoin-linked projects",1641027941.0
Estonia’s new AML laws set to clamp down on crypto industry,1641136179.0
First hack of 2022?,1641084399.0
Why Jerome Powell’s Policies Are Bullish For Bitcoin,1641158421.0
Is it dumb not to own BTC because it’s POW?,1641097462.0
"Most people don't understand what decentralization means, and I have a theory that even if they did, they wouldn't care for it",1641158580.0
“A Beginers Guide to Crypto” in major newspapers bullish sign or the top is in?,1641089724.0
Some just drained Tinyman of it's goBTC and goETH liquidity pools.,1641095678.0
Is the DeFi space too overcrowded?,1641154207.0
"Elon Musk on Lex Fridman podcast. Love him or hate him there is a good portion of the interview about crypto, Bitcoin and Dogecoin.",1641083080.0
Scam Alert: XUMM impersonators tryin to get your wallet.,1641151386.0
"Want to earn interest on my ETH, and keeping the keys, suggestions welcomed",1641045830.0
The Roaring '20s 2.0 - Get that FUD out of here,1641074331.0
"If we don't pay our taxes, we will get regulated to oblivion",1641047791.0
PulseX Sacrifice phase is currently ongoing. Already 260M$ participated within 72 hours. New and improved game theory AMM. What do you think ?,1641133739.0
Mexico to launch its own digital currency,1641057678.0
The end of the ad model,1641151186.0
Indian authority raids cryptocurrency exchanges after massive tax evasion,1641101197.0
Tinyman (Algo) LP exploit January 1&2,1641123281.0
I didn't realize that you have to pay tax on every single Transaction. How fucked am I?,1641081937.0
You just turned your small investment into a large sum of money - What are you doing next?,1641134452.0
Could The Graph Represent the Future of the DeFi Space?,1641082752.0
I played Crypto Royale every day for the whole december. Here is the outcome,1641044791.0
"Doesn't bitcoin totally obliterate the Wall Street maxim - ""Bulls make money, bears make money, but hogs get slaughtered""?",1641055640.0
One of the best deep dives into Nervos Network's CKB,1641150431.0
I bought & sold an NFT for profit and I genuinely don’t know how.,1641070079.0
"I've been in crypto for a year, this is what I've learned so far.",1641158392.0
Why is Grayscale GBTC trading below value still and are there scenarios where it will return to NAV?,1641138139.0
Could Reddit take on Onlyfans if they expand “token” offerings to subs like r/gonewild and other porn subs?,1641052331.0
I partook in a legit pump and dump so you don't have to,1641147567.0
You can easily run a full bitcoin node (not to be confused with a miner) using a raspberry pi and a 1TB SSD with Umbrel software,1641088717.0
MetaMask Wallet Tutorial…The Ultimate Guide On How To Use MetaMask Wallet,1641135151.0
"Pakistan freezes Over 1,064 bank accounts and cards of crypto traders",1641039199.0
Any reason not to get the CDC visa card? Are there any alternatives with better perks?,1641150853.0
I was happy for ONE pumping 9% but….,1641155435.0
What is your favorite platform to stake on at the moment and who has the highest rates?,1641076170.0
"AnetaBTC [Cardano & Ergo] partners with KyberSwap, creators of Wrapped Bitcoin",1641046295.0
"Bitcoin network is set to consume more than 200 TWh in 2022 which is equivalent to the electricity consumption of all data centers around the world (from Amazon to Facebook to Google, etc.)",1641147751.0
How Bitcoin Is Giving Elderly El Salvadorians A Reason To Smile.,1641098714.0
"Fellow crypto masters, novices, and amateurs. The key to spreading crypto knowledge both offline and in this group is education and patience to beginners!",1641099115.0
A 2021 roundup of the flagship crypto,1641089326.0
Patience is key,1641122640.0
Support my 2022 New Year’s resolution and help improve crypto adoption by asking for crypto payment options in your local store,1641068366.0
Contributors’ Convictions: A Bitcoin Legacy Letter,1641080827.0
Nobody knows what is going to happen for sure but let's hear what you think,1641133582.0
Market History Explained... Why We Should Prepare for the Bear Market..,1641009051.0
Advice on a starting point for someone who wants to learn but has no idea what she's doing.,1641150341.0
"2 Mirrored, Copycat Bored Ape NFT Projects Cause Copyright Infringement Controversy",1641118716.0
Ethereum white paper predicted DeFi but missed NFTs: Vitalik Buterin,1641131425.0
ELI5 - what 'promise' was broken by LRC?,1641039902.0
Robinhood launching cryptocurrency wallets: why you should avoid at all costs.,1641149550.0
This Crypto-Themed Restaurant in Florida Sells Dogedogs and Crypto Cuban Sandwiches,1641081939.0
I bought Matic at .26 and still hodling! Will Ankr be the next Matic ?,1641159005.0
Don't dismiss criticism of a project just because you are invested in it,1641057859.0
Can someone help me understand the purpose of a stablecoin?,1641063470.0
"Ethereum Reminds GPU Miners the End Is Near - The Merge and the end of mining. It actually has a Unitology kind of vibe, just without the aliens or the helpless, big titty ""scientist"" you got to save.",1641061414.0
US SEC Head Hires Crypto Advisor Amid Continued Regulatory Uncertainty,1641068001.0
"Over $467,000,000 Worth of Bitcoin Leaves Coinbase in Just One Week",1641138871.0
Effect of mining on android?,1641157102.0
"Instead of victimizing crypto, take responsibility and be positive!",1641114749.0
Cryptocurrencies: ethereum will challenge the hegemony of bitcoin | Financial Times,1641143577.0
"[Best Of 2021] Rich Dad Poor Dad's Author Says 'The Biggest Crash In History Is Coming,' Recommends Buying Bitcoin, Gold",1641116006.0
InvestAnswers Details Big Bitcoin Price Prediction for First Half of 2022 – Here’s the Target - The Daily Hodl,1641146778.0
Official announcement by Tinyman regarding exploit,1641141312.0
Should NASCAR Allow the Let’s Go Brandon Token ($LGB) Sponsorship of Brandon Brown to Proceed?,1641087820.0
India's Central Bank RBI Says Crypto Is Prone to Fraud and Poses Immediate Risks to Consumer Protection – Regulation Bitcoin News,1641145583.0
Crypto outperformed every other major asset in 2021,1641111503.0
"Weekly News Summaries - January 2, 2022",1641146418.0
I don’t think Cardano is staying in the top 10-20 for 2022. Here is why.,1641070553.0
"Cartesi, a project worth looking for in 2022.",1641038031.0
Please help me secure my crypto. Am i missing anything?,1641100455.0
Building an IRL Crypto Village: Crowdsourcing Good Ideas,1641114667.0
Predicting the crypto market is like predicting if the flight will be get cheaper or more expensive tomorrow.,1641137619.0
"Ether drops below $3,800, but traders are unwilling to short at current levels",1641036073.0
Should NFTs be in Video Games? | ZeMain,1641140651.0
Your wallet is more vulnerable than you think and you should really change your view on security when it comes to crypto.,1641026344.0
"Any trading platforms that explicitly don't allow scam, worthless, or fraudulent coins?",1641147026.0
Best interoperability Blockchain ATM and why?,1641073994.0
Catalysts that fueled the 2021 bull run. Will 2022 see another rally? (Timeline),1641059817.0
Polygon co-founders say they've gotten rid of C-suite positions,1641045167.0
How low can Eth go? (Next bear market),1641129467.0
"In El Salvador, Bitcoin’s Libertarian Streak Meets an Autocratic Regime",1641129806.0
How would you describe or explain crypto to older people? What is Crypto? ELI60.,1641101981.0
What are your 90% / 50% / 10% predictions for Cryptocurrency in 2022?,1641072043.0
"Centralized systems are here to stay, says Binance CEO CZ",1641084035.0
Let me talk to you about this NFT game called DeFi Kingdoms,1641142991.0
GigaChad Michael Saylor best moments - Bitcoin song,1641146687.0
".ETH names are seeing record registrations. This is great news for us as it implies towards a greater adoption rate, and adding to that- celebrities getting the ENS domain also increases the awareness amongst general public",1641065777.0
Dubai World Trade Centre to create a new crypto hub and become regulator,1641064523.0
IOTA 2.0 DevNet Nectar Release - The first version of a fully decentralized IOTA network,1641040861.0
"FYI: Your coins are going up not because they are ""superior technology"" but because this is a macro-bull market. 18 months ago nobody knew your coin existed.",1641131165.0
What are some of the best ways to make money in Cryptocurrency space in 2022 ?,1641097864.0
Top cryptocurrency service providers raided for massive tax evasion | India,1641059982.0
Bitcoin hash rate opens January with new all-time high,1641158823.0
COSMOS… why you should research the ecosystem.,1641060174.0
What was your last big win in the crypto markets?,1641050542.0
Got compromised and lost over $120k in crypto; AMA,1641069798.0
Most successful people in this sub don't tell truth about their profits or investments. They stay quiet or lower their numbers.,1641154015.0
Harmony and AAVE Are Ready For the Market Trends in 2022! Will ONE and AAVE Price 5X?,1641059497.0
Vitalik Buterin Speaks To Argentina: “Decentralization Goes Far Beyond Money”,1641066251.0
Stable coin lending,1641069228.0
10/12 years BTC has closed in profit. Will 2022 make it 11/13?,1641061472.0
My research on the coins added to CMC recently. 2nd Jan 2022,1641138717.0
Arbitrage opportunities in developing countries with strong fluctuations in exchange rates,1641112591.0
A good portfolio should contain a big portion of BTC and ETH.,1641078257.0
"If Satoshi was going to move coins or go public, how should he do it?",1641115497.0
"Need some advices: If I sell price skyrockets, if I hodl price stagnates and if I buy price dumps; Who can explain!?!",1641075889.0
All Time Highs INCOMING For This Altcoin!!,1641157944.0
I bet the IRS knows all about our portfolios since they have access to all private chat platforms,1641138189.0
Is it a good time to enter the market right now as a newcomer?,1641130270.0
Now is the time to move your ETH!,1641035003.0
"DYOR is good for avoiding scams, but it is useless against hacks and exploits. Some trust is needed and ultimately only projects that do not abuse it will succeed.",1641128484.0
Received a weird Bitcoin text message,1641151009.0
"The Year In Review: Crypto Is Here. Get Used To It, Washington.",1641049961.0
The $1.4mn lost in Matic's exploit could have been $20.2 bn.This is bad but The Core Developer's silence over the issue for almost a month is even worse!,1641040925.0
Bitcoin: will hashrate double in 2022?,1641066701.0
Passive Crypto Income Streams,1641144505.0
What do I need to learn to become a blockchain developer? Is it still possible for me?,1641092023.0
"NFTs are all the rage right now, but a new study shows that a small portion of participants -- mainly ""whitelisted"" insiders who get to buy early at lower prices -- reap most of the gains.",1641138332.0
Ethereum Co-Founder Vitalik Buterin Calls Bitcoin Cash a Failure,1641115402.0
Bitcoin closes lucrative year with a whimper | Crypto News,1641136151.0
Crypto trading is a very hard job to do and requires constant attention. Its morally correct to be in it just for the money.,1641148096.0
[NOOB] I tried to withdraw funds from KuCoin using XLM but ended up with less than I should... (VET->XLM->USDC->VET),1641128159.0
Bitcoin Year in Review 2021 Highlights,1641057890.0
One of the biggest European cryptocurrency fucktard scammers arrested in Spain,1641127408.0
"EU: Netherlands users, remember to document your entire crypto holdings today. De Belastingdienst uses Jan-1st as the snapshot date to value your portfolio.",1641033318.0
Your favorite coin and it's biggest weakness,1641085033.0
What is it about Charles Hoskinson that makes so many people distrust him?,1641054194.0
Someone created a fake Metamask Airdrop Token $MASK by Exploiting DexTools and stole hundreds of ETH.,1641133656.0
What would you do if Bitcoin hit 10k again?,1640979523.0
What’s the hardest you’ve ever gotten rekt from a coin or token?,1641156140.0
World's First NFT Space Collection Taken by ISS Will be Hosted by Major Crypto Influencers Read more at https://ihodl.com/press-releases/2021-12-30/worlds-first-nft-space-collection-taken-iss-will-be-hosted-major-crypto-influencers/,1641083823.0
My first cake day: evaluations after 1 year in crypto,1641140169.0
Low-entry barrier crypto Launchpad?,1641137769.0
"The $2 Trillion Cryptocurrency Market Is Drawing Interest From Investors, Scrutiny From U.S. Regulators",1641121203.0
Anyone else saving in Crypto and completely ignoring banks?,1641114664.0
What mistake do you refuse to repeat this year? Your 2022 crypto goals.,1641101073.0
Best lifehacks in crypto that beginners should know about,1641051737.0
"Chainlink Founder, Sergey Nazarov, gives an update on the project, states CCIP and Staking will be released in 2022. (1:05:00)",1641072047.0
Bitcoin's computational power may double and make the market more secure in 2022,1641055368.0
Am I the only one expecting big things tomorrow?,1640991412.0
First time I see blockchain tech in use,1641060135.0
Billionaires Are Embracing Crypto in Case Money ‘Goes to Hell’,1641050912.0
Square Enix says it hopes NFTs and blockchain become ‘a major trend’ in games,1641047204.0
"If you aren't confident in your ability to protect your personal info, you shouldn't be investing in crypto.",1641102518.0
"MicroStrategy Purchases Additional 1,914 Bitcoin, The company now has more than 124,000 BTC.",1641030817.0
How many times will bitcoin die in 2022?,1641149222.0
Europe’s biggest tax haven is about to become a cryptocurrency hub,1641062520.0
Play to Earn games are helping me a lot to keep investing in cryptocurrencies,1641122255.0
Ethereum’s Buterin doubles down on proof-of-stake; calls ‘BCH mostly a failure’,1641120036.0
MicroStrategy Clearly Has its Finger on the Market Pulse,1641019423.0
Tell us about your investment regrets in general and crypto which is part of it.,1641156293.0
NFTs are a scam. Change my mind.,1641089569.0
I analysed if coins/tokens actually pump after Coin Bureau mentions them,1641030476.0
Can I retrieve my ATOM?,1641070960.0
Asked my dog what crypto to buy.,1641120158.0
Tokenomics as Governance - a DAO experiment. WDYT?,1641132433.0
What was the worst crypto hack?,1641153785.0
"The Future is Bright!!… “President Bukele predicts Bitcoin $100k rally, further legal adoption and more”",1641117203.0
There's so many financially illiterate people here,1641151189.0
"In 2021, tech talked up ‘the metaverse.’ One problem: It doesn’t exist",1641116233.0
Can not wrap my head around this,1641139332.0
Looking for info on blockchain based social media alternatives.,1641148659.0
"First-mover advantage, branding and timing is more important than a project's team, tech and roadmap?",1641119572.0
"Be Honest , do you really understand enough about how your coin works to believe in it ? or do you believe in it because a bunch of people believe in it and say it is the next big thing (and it has a lower market cap than its competitor)",1641065168.0
WhatsApp Has Deployed Crypto Payments Via Chat In The United States,1641039753.0
"Bitcoin price: BTC set for '$220,000 in 2022' as billionaires fear dollar will go to hell",1641156152.0
What if Reddit streaming was rewarded with moons?,1641127133.0
SquareEnix embracing Crypto/NFT,1641133144.0
A look back at the biggest bitcoin ETF news of 2021,1641150641.0
"What’s ahead for crypto and blockchain in 2022? Experts Answer, Part 2",1641143286.0
"At a Bank of England conference, the Managing Director of the International Monetary Fund has speculated that Bitcoin and cryptocurrency have as much of a future as the Internet itself. It could displace central banks, conventional banking, and challenge the monopoly of national monies",1641086399.0
Is this time different,1641136882.0
Visual reminder why people often tell to stick to proven crypto assets,1641048834.0
What was the first and the last coin you bought this year?,1640969022.0
Eminem Splurges $462K On Bored Ape NFT,1641151883.0
Cardano Leads Pack With Most Developer Activity in 2021,1641130377.0
Is Bitcoin a Good Inflation Hedge?,1641100848.0
BTC and ETH are not the solution if you have little money to invest,1641144928.0
Syscoin - what do you think about it?,1641118977.0
Argentine government blames bitcoin mining for energy crisis,1641141004.0
Tax question; Coinbase,1641143075.0
South Korean Politician and Former Civil-Rights Attorney Lee Jae-Myung will be Accepting Crypto Donations for his Presidential Campaign,1641144325.0
"Welcome to 2022 & (fear!, no greed!, no extreme fear!!, no real greed!!, no....)",1641069667.0
Federal Reserve Board Governor Christopher Waller says that stablecoins do not need to be regulated with all the same rules as banks,1641085955.0
"I'm new to crypto, hoping for some suggestions on the best places to stake/lend for passive income.",1641148319.0
ALGO Tinyman DEX exploited. remove all your liquidity now.,1641122608.0
"Despite Negative Mining Malware Press, Privacy-Focused Crypto Monero Jumps 36% in 2 Weeks",1641058830.0
Will Bitcoin ever be overtaken?,1641151306.0
First LGBT+ cryptocurrency bets on 'changing the world',1641155726.0
anetaBTC — KyberSwap Partnership,1641045256.0
"Affected Users Will Be Compensated for Losses, per Tinyman",1641141469.0
"Whether it's 2021 or 2022,One thing will never change I.E. Crypto Exchanges crossing limits to make money!",1641141764.0
Coin investing for newbies,1641108072.0
What’s your strategy?,1641069722.0
Tinyman exchange liquidity has been drained by an exploit - If you haven't already pulled your liquidity do it now.,1641145395.0
"Polkadot Price Analysis: DOT Spikes 8%, Heading Towards Crucial Resistance",1641140293.0
Bullish numbers for BAT! Brave just reached over 700k Youtube Creators!,1641114315.0
Thoughts on Oasis Network (ROSE)?,1641071611.0
"MicroStrategy Buys Another $94,200,000 Worth of Bitcoin",1640966557.0
So what if you don't see value on NFTs or the Metaverse?,1641053203.0
Sberbank Launches First Blockchain ETF in Russia – Finance Bitcoin News,1641101505.0
"No, not paying taxes is not a ""brave"" move",1641032427.0
Does anyone else that finished 2021 with losses feels weird filing their crypto taxes?,1641054314.0
Can we ban this crazy moon farmer already?,1641012297.0
"Shark Tank celeb Kevin O’Leary, also referred to as Mr. Wonderful, says he is prepared to extend his crypto allocations to as much as 20% of his portfolio",1641087278.0
Current thoughts on bitcoin?,1641123796.0
How to know if a Financial/Investment advisor is legit or not ?.,1641091462.0
Web3 and is it a buzzword or actually the future?,1641146120.0
What are the downsides of Brave/BAT which are limiting it from being mainstream?,1641053368.0
If you were going to spend a few thousand in crypto would you spend it now or wait? 🔮,1641079456.0
The Ghost of Mt.Gox Part 4: HODL to poverty,1641122074.0
Revuo Monero is Back! Issue 101. Happy new year everyone!,1641092547.0
Crypto.com Will Run Its First Super Bowl Ad Amid Marketing Blitz,1641154975.0
Ethereum (ETH) on its way to becoming a deflationary asset,1641048947.0
On a 3 minute Bitcoin chart: how much USD would the candle rise with a 1 million or 1 billion usd buy (on average),1641053491.0
2022 the year of the Tiger! Using Chinese zodiacs for predicting returns....,1641131353.0
Tricks Hackers Use To Steal Crypto From People On MetaMask,1641083498.0
"Daily Discussion - January 2, 2022 (GMT+0)",1641081615.0
"Crypto Exchange Binance 'Not Authorized' to Operate in Ontario, Says Regulator",1641011527.0
"Bitcoin Bull Anthony Pompliano Lays Out Crypto Outlook for 2022, Says BTC Could Be Correlated to This Surprising Indicator - The Daily Hodl",1641088804.0
