How I could potentially make you millions,1641136452.0
Bitcoin starts 2022 at $47.2K as fresh research pins performance on China trader exodus,1641138347.0
Happy 13th Birthday Bitcoin.,1641153216.0
If you told people in April that BTC would be under $48k and Eth under $3800 on 12/31 people would have said you were totally nuts and dumb,1640960855.0
I do not think ETH will be the main NFT marketplace when it evolves beyond rehashed portrait-template status.,1641111751.0
Fantom Price Analysis: Is FTM Coin Price Ready To Test $10 In 2022?,1641124785.0
Streamline my portfolio,1641158979.0
"0.2 Zettahash: Bitcoin's Hashrate Taps New Lifetime High, Mining Difficulty Nears ATH",1641150941.0
New Stellar Cannacoin looking to do good things for the cannabis industry,1641105207.0
Some people on this sub seem to love praising Litecoin but it has underperformed Bitcoin and Ethereum for years now.,1641004841.0
What To Expect From Polkadot in 2022 According to Ethereum Co-Founder Gavin Wood,1641073275.0
Billionaires Are Embracing Crypto in Case Money ‘Goes to Hell’,1641146745.0
"Lee Jae-myung, the presidential candidate of the ruling Democratic Party of Korea, will accept cryptocurrency for campaign donations",1641113179.0
"Eminem Buys a Bored Ape NFT for $462,000",1641072553.0
Vitalik Buterin is Right about Bitcoin Cash being a Failure,1641136438.0
Reviewing The Historic Battle 🥊🤼‍♂️ Of Ethereum vs. Cardano,1641095013.0
How Soon Will Any Metaverse Be Indistinguishable From Reality?,1641126810.0
"If You Hold Solana, Tell Me Why",1641004288.0
"This year 2022, the greatest bullrun in human history will happen!!!",1641044104.0
1 Year Alt-Coin DCA Experiment - Week 11 Update,1641076362.0
Ferrari: New NFT partnership with Swiss company Velas,1641136442.0
"Mozilla Now Accepting Donations in Dogecoin, Users Threaten to Quit Using Firefox in Response",1641149587.0
The Multichain future (and why multichain sucks),1641156908.0
"A Crypto Whale Is Paying NFT Skeptics $10,000 to Try Ethereum",1641151204.0
how often do we pay in crypto?,1641097635.0
Klima tax loss harvest. But should I buy it back?,1641144575.0
[ANALYSIS] How good can your passive income on CRO get?,1641068763.0
Ethereum white paper predicted DeFi but missed NFTs,1641124450.0
Pay-to-play games was already bad - pay to earn won't be any better,1641144522.0
"Eminem Purchases Bored Ape Yacht Club #9055 for $452K, Shady's Portfolio Holds 166 NFTs",1641127334.0
How is a DAO different from a public company?,1641109337.0
r/CC Cointest - New Top 10 round - January 2022 — Share knowledge and earn moons if you win!,1641146830.0
The best way to NOT lose ALL your money on DUMB short-term trading. (I wish someone told this in the beginning),1641076539.0
"Ok I'm doing it, I'm getting back in school",1641153066.0
Crypto gives me hope for the new year,1641126077.0
Finally did it: I made a crypto trading bot that automatically places orders on new listings before they get added on Binance or Kucoin,1641145036.0
Goldman Sachs and other Wall Street Banks are exploring Bitcoin-Backed Loans. Goldman Sachs is among a handful of tier-one U.S. banks figuring out how to use bitcoin as collateral for cash loans to institutions,1641086637.0
Start 2022 with this Crypto Apps on your mobile,1641135454.0
"The more I learn, the dumber I feel. What aspect of crypto is the most confusing in your opinion?",1641076166.0
"2 Mirrored, Copycat Bored Ape NFT Projects Cause Copyright Infringement Controversy",1641073997.0
Mining POW Coins Vs Being a Validator for a POS chain and running a stake pool?,1641077863.0
Great read by CoinMarketcap -- ETH and Altcoins: Predictions for 2022,1641085732.0
World Map Statistics: Which Coins Received the Most Attention in 2021?,1641124621.0
Wonderland Treasury is missing $550M. Founder exits TIME holdings,1641098953.0
"The crypto market might be making things difficult for you right now, but remember you are already more fortunate than 90% of the planet because you are in it.",1641080727.0
These 5 U.S. States Are the Best for Crypto Investors,1641136701.0
"Could a person set up a decoy wallet on their PC to serve as sort of a crypto equivalent of an Amazon box on the doorstep, full of glitter or cat turds?",1641145888.0
"Square Enix (company behind Final Fantasy XIV, biggest MMO currently) has plans to introduce NFT to its games. Bullish!!!",1641139967.0
Bitcoin starts 2022 at $47.2K as fresh research pins performance on China trader exodus,1641126902.0
Here's why giving crypto advice to beginners is almost completely futile.,1641082455.0
"The financial authorities of Mumbai (India) on December 31 confirmed that they had discovered tax evasion by WazirX, a cryptocurrency exchange owned by Binance.",1641106037.0
January calendar: 13 years since the launch of bitcoin,1641102530.0
Abu Dhabi aiming to be global cryptocurrency leader,1641051109.0
"A new year, new predictions, shills and trends",1641082249.0
Half a Dozen of India’s Crypto Exchanges Searched After Alleged Rupee 700M Tax Evasion Detected,1641058130.0
Burning Questions: Could this be the year crypto finally goes mainstream?,1641102716.0
99% of the market depends solely on the hype factor,1641067182.0
Crypto's Domino effect,1641091764.0
The hardest part of investing is doing nothing,1641000577.0
Crypto tycoons help drive global art market to record levels in 2021,1641136226.0
"What was your biggest 'bought high, sold low' moment?",1641116789.0
Mexico Announces It Will Issue Its Own Digital Coin by 2024 – Bitcoin News,1641043179.0
Ava Labs' John Wu predicts crypto asset market could hit $5 trillion in 2022,1641028151.0
DEFI: Who's Hot And Who's Not....,1641064258.0
What are your thoughts on videogame companies/developers implementing crypto/NFTs onto their games?,1641097179.0
Safest way to park your gains long term: how safe are stablecoins?,1641110126.0
Year 2021 Data Cements Bitcoin As Risk-On Asset,1641130483.0
What will happen to your crypto when you die? | School of Block,1641142814.0
"Long-term, most coins will die, but most chains will thrive",1641139130.0
"Introducing the Trivergence: Transformation driven by blockchain, AI and the IoT",1641114753.0
Basic facts that prove we are still early to the crypto game,1641086859.0
Why we need banks in cryptoverse - Flame resistant pants on,1641134417.0
[PSA] Wallet Verification is always a SCAM,1641006615.0
"The potential for bitcoin in Africa is very good, with 60% of the world’s mobile money already passing through the continent, and Nigeria being the world’s second-largest bitcoin market after the USA",1641085893.0
"Want to avoid almost all crypto scams and ""hacks""?",1641136643.0
"Cosmic Universe, an upcoming blockchain MMORPG on the Harmony ONE blockchain",1641126838.0
ELI5: How do scam Coins work?,1641132250.0
Binance to Step up Investment in France by up to $113M,1641117355.0
trevor —> ledger,1641125080.0
Oscar-Winning Rapper Eminem Purchases Bored Ape Yacht Club NFT for $462K,1641036937.0
Do you like that the crypto markets are open 24/7?,1640978525.0
At What Point Will We Stop Valuing Crypto in Terms of its USD/Fiat Equivalent?,1641096677.0
"Top 5 cryptocurrencies to watch this week: BTC, LUNA, FTM, ATOM, ONE",1641146941.0
Bitcoin Wallet With $24M From Satoshi Era Suddenly Activates After 10.5 Years - BeInCrypto,1641065965.0
Did you pay tax on your crypto? How much and how stressful was it?,1640959260.0
Algorand prospering in DeFi might set it up for an ATH,1641016285.0
Buyers and Sellers: The basics of price,1641109715.0
Ethereum white paper predicted DeFi but missed NFTs: Vitalik Buterin,1641136141.0
"Happy new year! Last year around 3,250 BTC were traded in Venezuela (only measured using only LocalBitcoin) where the official minimum monthly wage is 2.2 USD! (End of year stats)",1641048991.0
Do you think celebrities privately invest in crypto?,1641097898.0
ItaliaRegina.it enters the NFT world to promote Italian food,1641157308.0
"So many posts about how 2022 will be a good year for Crypto, you know what that means",1640998288.0
Perhaps a stupid question,1641139752.0
Survey: Only 24% Think Bitcoin Price Will Be Below $50K By End of 2022,1641045297.0
"For those of you who worry if you are early or not. World growth doesn't stop...even if all the old timers don't like crypto, they are not the future. World Population Clock: 7.9 Billion People (2022)",1641133312.0
Chromia CHR: A Blockchain and Second Layer for the Next Generation of dApps,1641151126.0
The first ever RPG adventure game on Zilliqa: Okipad Gears Up for the Launch of Heroes of Lowhelm in January 2022. - Digital Journal,1641085648.0
Midcaps to consider in 2022,1641065410.0
TINYMAN Dex was warned of the exploit and we're even given a solution by the Auditors!,1641129650.0
Cryptocurrency Burning Definition,1641146834.0
"Ethereum Co-Founder Vitalik Buterin Calls Bitcoin Cash A Failure, Reflects On His Crypto Commentary From 2013",1641151790.0
"Litecoin delivers 100,000,000th transaction today after 10 years of 100% uptime & constant user growth.",1640979787.0
"Grayscale Holds $43B in Crypto Assets Under Management, Down From $60.9B in Early November: Grayscale Bitcoin Trust and Ethereum Trust AUM have dropped 30% and 22%, respectively over this time period.",1641143061.0
Would this crypto help you avoid taxes?,1641124683.0
What percentage of your assets are in some form of crypto?,1641149771.0
"Official Announcement about the Tinyman DEX exploit. Great response by the Tinyman team, they will compensate anyone who lost funds in the attack. While this sucks in the short term, I have no doubt this will be a learning experience and the community will come out stronger.",1641152758.0
"Despite Litecoin being actually used with Solid User Growth, it is one of the Worst Performers since the beginning of the Bullrun",1641071085.0
Spain: Registry opened for crypto-exchanges and custodian wallet providers,1641049589.0
My sincere wishes for 2022,1641153062.0
"After WazirX, DGGI crackdown on Coinswitch Kuber, CoinDCX, BuyUCoin and Unocoin",1641058954.0
"What are your thoughts on this statement?: ""The more you use crypto, the more you support crypto.""",1641091644.0
Give me reasons why I should buy some ETH?,1641155272.0
10 of 12 Bitcoin Yearly Candels Are Green,1641074553.0
Bitcoin has risen 7%–36% in the first week of January each year since 2018,1641001112.0
"Over $467,000,000 Worth of Bitcoin Leaves Crypto Exchange Coinbase in Just One Week",1641144002.0
"UAE Imposes Five-Year Jail Term and Up to $272,000 in Fines for Crypto Scam Artists",1641092735.0
"78% of Crypto Investors believe in fake Statistics: ""48% of Americans bought Crypto in just 6 Months"", ""40% of Americans want Crypto to partially replace their Paycheck""",1641140390.0
Jack Dorsey VS Web 3.0: Why Twitter’s Founder Is A Bitcoin Maximalist,1641134275.0
"If everyone here followed their own advice, you’d have an abundance of free time and no stress over crypto investments",1641069701.0
What is SuperWorld? 2 days ago their CEO appeared on CNBC when I first heard of the project,1641112597.0
"2 More Countries Will Adopt Bitcoin in 2022, Says Nayib Bukele",1641114302.0
"Cardano was the most-developed crypto on Github in 2021, study finds",1641107286.0
Working out tax amount after selling crypto - missing something obvious?,1641139868.0
"Crypto influencers targeted by French government agents ""The French Government have established a new task force aiming to target and tackle the rise of influencers that seek to capitalise on their audiences through paid promotional sponsorships from crypto firms.""",1641042008.0
3 Explosive Cryptocurrencies That Could Outpace Bitcoin in 2022 | The Motley Fool,1641152704.0
Square Enix President’s New Year Message Discusses NFTs and Blockchain Games,1641047570.0
I stored my hot wallet's seed phrase on a password manager connected to my main computer... Should I nuke the wallet?,1641143974.0
What do we think about Crypto.com's Visa cards? Are there better alternatives?,1641136905.0
"Shiba Inu Shedding MemeCoin Tag, Moves Big Into DAOs With Beta Version Launch",1641133740.0
Algorand governance round 2 has started. Don't forget to participate.,1641113623.0
"Daily Discussion - January 1, 2022 (GMT+0)",1640995213.0
"Metaverse, AI and and other big digital trends to watch in 2022",1641147050.0
El Salvador President Nayib Bukele Predicts Two More Countries Will Make Bitcoin Legal Tender In 2022,1641098293.0
Cryptocurrencies: ethereum will challenge the hegemony of bitcoin,1641151567.0
Ethereum’s gas fees ARE a problem. No matter what you think.,1641060103.0
Can DAO replace Federal Reserve or whatever central bank you have in your country? | Canary Academy Article,1641133728.0
With tax season upon us I wanted to share my experience with CryptoTrader.tax - and would like to hear about other peoples experiences with other crypto tax tools.,1641101972.0
"Tell us about your past year's experience in crypto, using only 1 word",1641066077.0
Does anyone else really like 'doing stuff' with their crypto?,1641050045.0
Lost my ETH.... Advice,1641050425.0
Make this your resolution: DO YOUR TAXES,1641130318.0
2022 or 2023 Stablecoin regulation,1641044854.0
Are you for some kind of regulation or against any form of regulation?,1641153767.0
Turkey Reveals Scheme That Encourages the Conversion of Gold Deposits Into Lira Time Deposits,1641124310.0
SHIB Devs Announce First Phase of Doggy DAO,1641159352.0
TIL: Bitcoin uses a better sustainable energy mix than any major country or industry,1641083101.0
Does anyone actually play Crypto games? (Like Sandbox?),1641062987.0
A beginner’s guide to cryptocurrency,1641069126.0
Cryptocurrency World Map Statistics: Which coins received the most attention in 2021?,1641154212.0
Lottery,1641050326.0
"Billionaire Chamath Palihapitiya says Visa and Mastercard will be the biggest business failures in 2022, losing out to altcoin-linked projects",1641147409.0
Don't ignore your trading report and bank report,1641138482.0
MIS to build 6 data centers after $320m deal with Saudi Fransi Capital,1641121243.0
buying a Ledger of Amazon,1641127250.0
Why for the love of god does ELON SPERM coin exist?,1641039428.0
"Under the radar, or a play or just little interest ?",1641015963.0
Best way to reduce fees when transfering multiple types of coins?,1641067956.0
Top 3 Altcoins to Keep an Eye in 2022,1641152188.0
Ariane Capital Notes Stellar Crypto Investment Fund Performance Despite 2021’s Bearish Periods,1641115839.0
Can anyone tell me if this address is KYC'd on Binance?,1641133942.0
ATOM from Coinbase to Crypto.com Defi (cheap and easy),1641070315.0
"Yes, Algorand is the best distributed ledger technology. However, the best tech doesn't necessarily win the market.",1641082659.0
The crypto assets conundrum,1641151736.0
Some Musings on Bitcoin Distribution — More and More Long-Term HODLers and Illiquid BTC. This supply shock will sooner or later affect the price of Bitcoin.,1641150784.0
Finality—A look inside IOTA's new many-worlds Nakamoto consensus mechanism (OTV),1641081810.0
Dogecoin and ETH we’re the only cryptocurrencies in the Top 10 most searched trends on Google in 2021. Doge ranked #4,1641102995.0
Early buyers of solid projects such as DOT and MATIC…,1641122668.0
Realising loss of dead coin for tax purposes,1641071744.0
XRP & Flare Community: Poloniex have your SGB tokens in their wallet!,1641131458.0
Which exchange should I use for a little more active trading?,1641153599.0
Dead Man's Switch - QuadrigaCX | Gerald Cotton - Crypto scam. Check out the Documentary here.,1641080200.0
A valid criticism of a project is not spreading FUD,1641069998.0
Tracking and hodling the top 100 in 2022 and beyond (data included),1641065114.0
Vitalik Buterin Admits: I completely Missed NFTs Despite Predicting DeFi,1641156661.0
Happy new year fellow crypto enthusiasts.,1641040599.0
Can crypto be seized in a legal case?,1641076768.0
Vitalik Buterin reminds users internet of money should not cost more than 5 cents,1641148855.0
What is the lowest percentage of your portfolio that you're willing to invest in a coin or token?,1641092552.0
"It's so funny how people in crypto complain about big banks or government but when a smarts contract hack occurs, cry out for those to help",1641144551.0
German Youtuber made a Video about El Salvador - his experience using bitcoin aswell,1641137097.0
Shiba Inu Brick Buster | 120 Million Burned,1641139897.0
Expoit drains goETH goBTC and OPUL liquidity from tinyman,1641119104.0
"One of the biggest crypto exchange in India, fined about 6.6 Million dollars for tax evasion.",1641089819.0
"Vitalik Buterin: ""Bcash has failed""",1641093686.0
Deflation isn't inherently good,1641137910.0
PooCoin is worth $1.40. How? Please Explain.,1640988677.0
Trading Platform Robinhood Announces Upcoming Launch of Cryptocurrency Wallets,1641082112.0
What is the most you've lost on a crypto purchase? Why did you buy? Why did you sell?,1641148863.0
"CryptoBike, a rugpull project got doxxed by its user. Now they're offering refunds to investors.",1641096401.0
"BOUNTY UPDATE: Grim Finance Hacker has started to move the >$30M stolen December 18th, will we catch him; or will he/she/them get away?",1641120763.0
"2 More Countries Will Adopt Bitcoin in 2022, Says Nayib Bukele",1641124598.0
"Bitcoin Closes 2021 at $46,300",1641044935.0
Historically January is a GREAT Month for Crypto,1641027415.0
The GRAPH - Google Of Blockchains - Explained in this great educational video,1641133485.0
Crypto portfolio app,1641119745.0
PKT is the Next Big Thing in Crypto Read more at https://ihodl.com/analytics/2021-12-29/pkt-next-big-thing-crypto/,1641116715.0
"Crypto is going to be 'very hot' going into 2022, says Race Capital CEO | Finbold",1641017247.0
Bank of Mexico Planning to Introduce CBDC by 2024,1641045038.0
"Kevin O'Leary Reveals Crypto Strategy, Why He Prefers Ethereum, Says NFTs Will Be Bigger Than Bitcoin",1641090765.0
"If bitcoin and crypto are such great hedges against inflation, why are the prices going down while inflation is high?",1641150983.0
North Korea-linked threat actors stole $1.7 billion from cryptocurrency exchanges,1641142126.0
"If you care about the adoption of Cryptocurrency, you should really be paying attention to what the Flexa Network is doing.",1641135355.0
"Careful of Scam tokens, where if you try to swap them, you get your funds taken.",1641157941.0
"Reddit and Crypto: Doge, Bitcoin, Elon Musk, and a Look Back at 2021",1641153695.0
Indian Authorities Raid Cryptocurrency Exchanges for Tax Evasion,1641090365.0
zkRollups - thoughts for 2022?,1641114109.0
What happened to the dude that was gonna eat his own shit?,1641100146.0
Regulation isn’t nigh,1641077789.0
Crypto tax software and multiple years,1641071327.0
Taxmen may come knocking on the doors of more crypto exchanges,1641141218.0
Crypto.com. Tell me I'm wrong...,1641152657.0
Purchasing crypto as American outside of USA,1641141210.0
Are Crypto Currencies to Blame for High GPU Prices?,1641069957.0
"If you bought BTC exactly one year ago and HEDL you're up 73%, and if you did that with ETH you're up 454%. Prices of both are now very close to what they were 90 days ago. Are you buying now or waiting for a better dip? Is this a buy opportunity or are better ones on the horizon?",1641040308.0
NY and Crypto,1641057494.0
NFTs seem to be everyone's favorite punching bag these days,1641046937.0
Bank of Jamaica reports digital currency pilot success,1641103606.0
Swap Trading and Taxes,1641104439.0
NFT time capsules: the next big thing in Crypto?…,1641159697.0
Israel Reportedly Seized $840K in Cryptocurrencies From a Company Linked to Hamas,1641121501.0
"Bitcoin dominance is at a multi-year low, and looking likely to break to an all time low. Altcoins may be poised for a massive rally",1641109285.0
"Canadian Regulator Insists Binance Is Unauthorized, Calls the Crypto Exchange's Letter to Users 'Unacceptable'",1641044129.0
Some of my early Earn rewards and cash back rewards on Crypto.com have grown 900-1500%,1641154829.0
Here is how much you would have earned if you had invested 10k on January 1st 2021,1641121141.0
We all hate banks but you know what’s hard…?,1641141916.0
Polygon (Matic) and Terra (LUNA) Are Top Gainers in 2021! Will They Carry Forward Fame in 2022?,1641145183.0
Bitcoin PoW = Military,1641084582.0
"How Is Your Crypto Journey Going, Percentage Wise?",1641135534.0
What is the reason that made you choose crypto as an investment method? Is it the only one you use?,1641081067.0
Algorand Surges Amidst a Slow Market,1641034864.0
MicroStrategy Remains One Step Ahead With $94M Bitcoin Purchase,1641015459.0
"Yes litecoin has underperformed against btc and eth short term, but isn't that more reason to invest?",1641080381.0
"Is ""Not your keys, not your coins"" an oversimplification?",1641108882.0
Ava Labs’ John Wu predicts crypto asset market could hit $5 trillion in 2022,1641042101.0
Crypto Mining Tax: The Complete Guide,1641122904.0
The bull market is not over. Theory for an explosive 2022,1640966432.0
what would happen if there was a coin pegged to....ammo prices and whisky?,1641120592.0
India’s Biggest Cryptocurrency Exchanges Raided After Tax Evasion Was Detected,1641135385.0
Square Enix plans to invest more in blockchain gaming in 2022,1641059351.0
"vitalik.eth on Twitter: In 2013, I wrote this piece on ""how Bitcoin can actually help Iranians and Argentinians""...",1641083061.0
Best Bitcoin Books (with Reader Ratings) - Bitcoin Market Journal,1641059677.0
Iran orders crypto-mining ban to prevent winter blackouts | Crypto News,1641040981.0
Experiences Taking Crypto Paraphernalia through Airport Security,1641099255.0
Elon Musk: Cryptocurrency fixes the 'error in money',1641143641.0
*sniiifff* Smell that everyone? That’s the first-day-of-the-year-buys talking!,1641070811.0
"Todays Winners and losers: January 2, 2022",1641157250.0
Looking for Interest calculator,1641118719.0
Latest video hints at the solution to the risks of DEFI regulation:,1641108122.0
Question regarding the benefits of decentralized currency compared to centralized,1641042954.0
How do I get paid by starting a DAO?,1641103414.0
The MeTaVeRsE Said R Slurred. Part 2.,1641147111.0
Predictions For 2022 About Merge Eth2 Pos And Others Bitcoin Softfork Upgrade,1641064929.0
Favorite and least favorite things about crypto?,1641054963.0
"Lane Rettig, one of Ethereum’s former core developers : “Crypto is the beginning of a new economy that creates value for people everywhere,” and sees crypto impacting every corner of society",1641086531.0
Elon Musk's thoughts on crypto as the most effective form of money (analyzing Elon Musk's thinking in Lex Fridman's podcast),1641118754.0
Tips for New or Existing Crypto Investors,1641086467.0
Idea: crypto currency universal basic income,1641143498.0
Why gamers don't want NFTs.,1641142137.0
Can someone help me understand the withdrawal process?,1641112172.0
El Salvador's President predicts $100k Bitcoin in 2022,1641122408.0
PSA (and also warning) that Robinhood announced the beta launch of its cryptocurrency wallets.,1641133132.0
What is a unique feature your favorite coin has?,1641049035.0
"Cryptocurrency Was No. 1 Topic on Reddit in 2021, Dogecoin Top Crypto Subreddit.",1641024411.0
Unlocking utility is key for fashion brands launching NFTs in 2022,1641158748.0
Elon Musk: Cryptocurrency fixes money,1641063073.0
YokaiSwap ETH Initial Liquidity Offering (ILO) on 3rd January - First Layer 2 DEX built on Nervos Network,1641119912.0
What are your 90% / 50% / 10% predictions for the next year? (2022 edition),1641089240.0
"Thirteen years since the date within the first bitcoin block. Mazal tov on your bar mitzvah, bitcoin! Today you'll be reading from Genesis 1:3, ""The Times 03/Jan/2009 Chancellor on brink of second bailout for banks."" May you go from strength to strength.",1641159570.0
"25% of Teens would Choose Crypto Over Other Investments, Survey Shows",1641090453.0
The top 5 crypto predictions for 2022,1641132118.0
How do y’all feel about the NFT games with main stream companies?,1641075179.0
Loopring: What Is LRC and How Does It Make Ethereum Gas Fees Cheaper?,1640916299.0
Erased Old Phone before Transferring Google Authenticator. How can I fix this?,1641056864.0
"Question about US, mining, and miner 'rental/host' for business expenses / taxes",1641153693.0
Crypto History: The Time Kanye West Tried To Sue Dogecoin and Coinye,1641072167.0
"If Satoshi was still alive, what would be the most chaotic thing he could do?",1641133081.0
Contradictory values from the Coinbase Transaction history report vs. etherscan,1641074325.0
Find all your Moons distribution transactions,1641157272.0
Which U.S. States Are Worst for Crypto Investors?,1641145134.0
The United States Department of Defense will be using Constellation for sending data. State Channels will go live this year,1641158796.0
DeFi > WallStreet,1641137158.0
BTC Hash Rate Hits All-Time High - BeInCrypto,1641138100.0
"The most complete WHY, HOW, & WHAT of the NFT Ticketing use case",1641080447.0
Decentralized crowdfunding Kickstarter wants to decentralize and relies on Celo,1641136619.0
My take on Web3.0,1641140229.0
You go to work and they've changed to crypto. How do you want to be paid?,1641154107.0
ELI5 your method for taking profits and tax question (total noob),1641071574.0
"Todays Winners and losers: January 1, 2022",1641070846.0
A Coinbase-backed Crypto Startup Launches AR NFT Program - Herald Sheets,1641124930.0
Will the bull cycle end in 2022?,1641073180.0
What’s the most profit you’ve made from a single coin or token?,1641134568.0
I screwed up,1641073780.0
Polygon’s New Look Make It A Crypto Play For The Long-Haul,1641102910.0
web0 manifesto,1641134373.0
The hate on Cardano is unjustified.,1641151772.0
